{
  "$id": "https://github.com/kirchherr/TUC/schemas/bounded_compiler_emitted_gpu_observation_report.v0.schema.json",
  "$schema": "https://json-schema.org/draft/2020-12/schema",
  "title": "TUC Bounded Compiler-Emitted GPU Observation Report v0",
  "type": "object",
  "additionalProperties": false,
  "required": [
    "claim_boundary",
    "emission",
    "execution",
    "isolation",
    "privacy",
    "proof",
    "provenance",
    "report_digest",
    "schema_version",
    "workload"
  ],
  "properties": {
    "claim_boundary": {
      "type": "object",
      "additionalProperties": false,
      "required": [
        "blocked_claims",
        "device_access_gate_reinterpreted",
        "driver_security_review",
        "external_reproduction",
        "native_backend_gate_reinterpreted",
        "normal_executor_modified",
        "shared_display_risk_acknowledged"
      ],
      "properties": {
        "blocked_claims": {
          "const": [
            "arbitrary_source_programs",
            "cross_vendor_execution",
            "dynamic_shapes_or_inputs",
            "general_cuda_backend",
            "independent_reproduction",
            "native_performance_parity",
            "production_device_admission"
          ]
        },
        "device_access_gate_reinterpreted": {"const": false},
        "driver_security_review": {
          "const": "operator_attested_current_vendor_update"
        },
        "external_reproduction": {"const": "not_yet_supplied"},
        "native_backend_gate_reinterpreted": {"const": false},
        "normal_executor_modified": {"const": false},
        "shared_display_risk_acknowledged": {"const": true}
      }
    },
    "emission": {
      "type": "object",
      "additionalProperties": false,
      "required": [
        "code_generated",
        "code_generation_phase",
        "emission_contract",
        "emission_plan_verified",
        "generated_kernel_count",
        "identifier_policy",
        "operation_families",
        "runtime_generated_code",
        "source_intent_accepted",
        "source_intent_schema_version",
        "source_text_executed",
        "target_profile"
      ],
      "properties": {
        "code_generated": {"const": true},
        "code_generation_phase": {
          "const": "trusted_review_time_before_container_build"
        },
        "emission_contract": {
          "const": "bounded_cuda_emission.exact_source_intent_sm86.v0"
        },
        "emission_plan_verified": {"const": true},
        "generated_kernel_count": {"const": 2},
        "identifier_policy": {
          "const": "fixed_symbols_no_source_identifier_interpolation"
        },
        "operation_families": {"const": ["matmul", "elementwise"]},
        "runtime_generated_code": {"const": false},
        "source_intent_accepted": {"const": true},
        "source_intent_schema_version": {"const": "source_intent.v0"},
        "source_text_executed": {"const": false},
        "target_profile": {"const": "nvidia-sm86-compiler-emitted"}
      }
    },
    "execution": {
      "type": "object",
      "additionalProperties": false,
      "required": [
        "accelerator_class",
        "compiler_emitted_cuda_execution",
        "device_access",
        "driver_api_called",
        "jit_execution",
        "kernel_launch_count",
        "performance_measurement_collected",
        "physical_device_execution",
        "runtime_generated_code",
        "tuc_native_backend_admitted",
        "visible_device_count",
        "workload_device_allocation_bytes"
      ],
      "properties": {
        "accelerator_class": {"const": "nvidia_cuda_sm86"},
        "compiler_emitted_cuda_execution": {"const": true},
        "device_access": {"const": true},
        "driver_api_called": {"const": true},
        "jit_execution": {"const": false},
        "kernel_launch_count": {"const": 2},
        "performance_measurement_collected": {"const": false},
        "physical_device_execution": {"const": true},
        "runtime_generated_code": {"const": false},
        "tuc_native_backend_admitted": {"const": false},
        "visible_device_count": {"const": 1},
        "workload_device_allocation_bytes": {"const": 256}
      }
    },
    "isolation": {
      "type": "object",
      "additionalProperties": false,
      "required": [
        "capabilities_dropped",
        "cpu_limit",
        "driver_capabilities",
        "effective_capabilities_zero",
        "gpu_selection",
        "memory_limit_bytes",
        "network_access",
        "no_new_privileges",
        "non_root_gid",
        "non_root_uid",
        "pids_limit",
        "repository_mount",
        "root_filesystem_read_only",
        "runtime_boundary",
        "seccomp_mode"
      ],
      "properties": {
        "capabilities_dropped": {"const": true},
        "cpu_limit": {"const": 1},
        "driver_capabilities": {"const": ["compute"]},
        "effective_capabilities_zero": {"const": true},
        "gpu_selection": {"const": "single_logical_device_zero"},
        "memory_limit_bytes": {"const": 1073741824},
        "network_access": {"const": false},
        "no_new_privileges": {"const": true},
        "non_root_gid": {"const": 10001},
        "non_root_uid": {"const": 10001},
        "pids_limit": {"const": 32},
        "repository_mount": {"const": false},
        "root_filesystem_read_only": {"const": true},
        "runtime_boundary": {
          "const": "docker_compose_nvidia_device_request"
        },
        "seccomp_mode": {"const": 2}
      }
    },
    "privacy": {
      "type": "object",
      "additionalProperties": false,
      "required": [
        "device_name_serialized",
        "driver_version_serialized",
        "environment_serialized",
        "generated_source_serialized",
        "hardware_identifiers_serialized",
        "host_paths_serialized",
        "raw_tensor_values_serialized",
        "raw_timing_samples_serialized",
        "source_text_serialized"
      ],
      "properties": {
        "device_name_serialized": {"const": false},
        "driver_version_serialized": {"const": false},
        "environment_serialized": {"const": false},
        "generated_source_serialized": {"const": false},
        "hardware_identifiers_serialized": {"const": false},
        "host_paths_serialized": {"const": false},
        "raw_tensor_values_serialized": {"const": false},
        "raw_timing_samples_serialized": {"const": false},
        "source_text_serialized": {"const": false}
      }
    },
    "proof": {
      "type": "object",
      "additionalProperties": false,
      "required": ["claim", "contract", "scope", "status"],
      "properties": {
        "claim": {
          "const": "one_admitted_source_intent_lowers_to_reviewed_cuda_and_executes_on_one_physical_gpu_with_cpu_reference_equivalence"
        },
        "contract": {
          "const": "bounded_compiler_emitted_gpu_observation.physical_device.v0"
        },
        "scope": {
          "const": "single_fixed_compiler_emitted_remote_hardware_observation"
        },
        "status": {"const": "PASS"}
      }
    },
    "provenance": {
      "type": "object",
      "additionalProperties": false,
      "required": [
        "builder_image",
        "compose_contract_digest",
        "container_image_digest",
        "cuda_harness_digest",
        "dockerfile_digest",
        "emission_plan_file_digest",
        "emission_plan_payload_digest",
        "emitted_kernel_digest",
        "image_config_verified",
        "image_source_binding_verified",
        "ptx_jit_disabled",
        "runtime_image",
        "sass_target",
        "source_intent_file_digest",
        "source_intent_payload_digest",
        "worker_observation_digest",
        "workload_header_digest",
        "workload_manifest_file_digest",
        "workload_payload_digest"
      ],
      "properties": {
        "builder_image": {
          "const": "nvidia/cuda:12.8.1-devel-ubuntu24.04@sha256:4b9ed5fa8361736996499f64ecebf25d4ec37ff56e4d11323ccde10aa36e0c43"
        },
        "compose_contract_digest": {"$ref": "#/$defs/digest"},
        "container_image_digest": {"$ref": "#/$defs/digest"},
        "cuda_harness_digest": {"$ref": "#/$defs/digest"},
        "dockerfile_digest": {"$ref": "#/$defs/digest"},
        "emission_plan_file_digest": {"$ref": "#/$defs/digest"},
        "emission_plan_payload_digest": {"$ref": "#/$defs/digest"},
        "emitted_kernel_digest": {"$ref": "#/$defs/digest"},
        "image_config_verified": {"const": true},
        "image_source_binding_verified": {"const": true},
        "ptx_jit_disabled": {"const": true},
        "runtime_image": {
          "const": "nvidia/cuda:12.8.1-runtime-ubuntu24.04@sha256:828c4d878adcaa4265d80c95d8ec877149b49bb2419a4cf3bb6aa889bbb7ca2e"
        },
        "sass_target": {"const": "sm_86"},
        "source_intent_file_digest": {"$ref": "#/$defs/digest"},
        "source_intent_payload_digest": {"$ref": "#/$defs/digest"},
        "worker_observation_digest": {"$ref": "#/$defs/digest"},
        "workload_header_digest": {"$ref": "#/$defs/digest"},
        "workload_manifest_file_digest": {"$ref": "#/$defs/digest"},
        "workload_payload_digest": {"$ref": "#/$defs/digest"}
      }
    },
    "report_digest": {"$ref": "#/$defs/digest"},
    "schema_version": {
      "const": "tuc.bounded_compiler_emitted_gpu_observation_report.v0"
    },
    "workload": {
      "type": "object",
      "additionalProperties": false,
      "required": [
        "dtype",
        "elementwise_semantics",
        "input_policy",
        "input_shapes",
        "operation_families",
        "output_shape",
        "reference_correctness_passed",
        "semantic_origin",
        "workload_contract"
      ],
      "properties": {
        "dtype": {"const": "float32"},
        "elementwise_semantics": {"const": "relu"},
        "input_policy": {
          "const": "fixed_public_non_sensitive_test_vector"
        },
        "input_shapes": {"const": [[4, 8], [8, 2]]},
        "operation_families": {"const": ["matmul", "elementwise"]},
        "output_shape": {"const": [4, 2]},
        "reference_correctness_passed": {"const": true},
        "semantic_origin": {
          "const": "accepted_triton_research_source_intent"
        },
        "workload_contract": {
          "const": "research_triton_matmul_relu_4x8x2_f32.v0"
        }
      }
    }
  },
  "$defs": {
    "digest": {
      "type": "string",
      "pattern": "^sha256:[0-9a-f]{64}$"
    }
  }
}
