{
  "claim_boundary": {
    "blocked_claims": [
      "arbitrary_source_programs",
      "cross_vendor_execution",
      "dynamic_shapes_or_inputs",
      "general_cuda_backend",
      "independent_reproduction",
      "native_performance_parity",
      "production_device_admission"
    ],
    "device_access_gate_reinterpreted": false,
    "driver_security_review": "operator_attested_current_vendor_update",
    "external_reproduction": "not_yet_supplied",
    "native_backend_gate_reinterpreted": false,
    "normal_executor_modified": false,
    "shared_display_risk_acknowledged": true
  },
  "emission": {
    "code_generated": true,
    "code_generation_phase": "trusted_review_time_before_container_build",
    "emission_contract": "bounded_cuda_emission.exact_source_intent_sm86.v0",
    "emission_plan_verified": true,
    "generated_kernel_count": 2,
    "identifier_policy": "fixed_symbols_no_source_identifier_interpolation",
    "operation_families": [
      "matmul",
      "elementwise"
    ],
    "runtime_generated_code": false,
    "source_intent_accepted": true,
    "source_intent_schema_version": "source_intent.v0",
    "source_text_executed": false,
    "target_profile": "nvidia-sm86-compiler-emitted"
  },
  "execution": {
    "accelerator_class": "nvidia_cuda_sm86",
    "compiler_emitted_cuda_execution": true,
    "device_access": true,
    "driver_api_called": true,
    "jit_execution": false,
    "kernel_launch_count": 2,
    "performance_measurement_collected": false,
    "physical_device_execution": true,
    "runtime_generated_code": false,
    "tuc_native_backend_admitted": false,
    "visible_device_count": 1,
    "workload_device_allocation_bytes": 256
  },
  "isolation": {
    "capabilities_dropped": true,
    "cpu_limit": 1,
    "driver_capabilities": [
      "compute"
    ],
    "effective_capabilities_zero": true,
    "gpu_selection": "single_logical_device_zero",
    "memory_limit_bytes": 1073741824,
    "network_access": false,
    "no_new_privileges": true,
    "non_root_gid": 10001,
    "non_root_uid": 10001,
    "pids_limit": 32,
    "repository_mount": false,
    "root_filesystem_read_only": true,
    "runtime_boundary": "docker_compose_nvidia_device_request",
    "seccomp_mode": 2
  },
  "privacy": {
    "device_name_serialized": false,
    "driver_version_serialized": false,
    "environment_serialized": false,
    "generated_source_serialized": false,
    "hardware_identifiers_serialized": false,
    "host_paths_serialized": false,
    "raw_tensor_values_serialized": false,
    "raw_timing_samples_serialized": false,
    "source_text_serialized": false
  },
  "proof": {
    "claim": "one_admitted_source_intent_lowers_to_reviewed_cuda_and_executes_on_one_physical_gpu_with_cpu_reference_equivalence",
    "contract": "bounded_compiler_emitted_gpu_observation.physical_device.v0",
    "scope": "single_fixed_compiler_emitted_remote_hardware_observation",
    "status": "PASS"
  },
  "provenance": {
    "builder_image": "nvidia/cuda:12.8.1-devel-ubuntu24.04@sha256:4b9ed5fa8361736996499f64ecebf25d4ec37ff56e4d11323ccde10aa36e0c43",
    "compose_contract_digest": "sha256:0925067eebfbd0b7ece95b8c1ac5fef198a4185d6b3441c54f09f79c3adc0403",
    "container_image_digest": "sha256:cb5bdf86c18019a04b3c73864565b0e9a107523173a4e7cbd2c859d8e6c70f7a",
    "cuda_harness_digest": "sha256:0bd6597847f9541aed48f6e881136c5251db4b106b1686e8e0d5b3c336af314a",
    "dockerfile_digest": "sha256:4a298f44a5ccaea2450b83dee7a479c637db97574dac3993ce8628830266bbfa",
    "emission_plan_file_digest": "sha256:d19bbb2b77aad286a814b8bcb0b8fdddc528c68beb906a6c2fae49615b8378ae",
    "emission_plan_payload_digest": "sha256:bac664cbc3683ab536b09e5f6d4657c061ee7a3042b32be5b610c9e2eb3c8d6f",
    "emitted_kernel_digest": "sha256:246ffac0dda6946d980e2ea73bf4ad00e3d66c45700787dc8c3e742a81d39100",
    "image_config_verified": true,
    "image_source_binding_verified": true,
    "ptx_jit_disabled": true,
    "runtime_image": "nvidia/cuda:12.8.1-runtime-ubuntu24.04@sha256:828c4d878adcaa4265d80c95d8ec877149b49bb2419a4cf3bb6aa889bbb7ca2e",
    "sass_target": "sm_86",
    "source_intent_file_digest": "sha256:ad430b8afea64f246f68ab5f0c942ae65d8cfa987152b8f28e75b7a31eb1eee9",
    "source_intent_payload_digest": "sha256:79f0fbd3fad9baf3a77df0eea5a1250234c24cdb7d5d6dd703e595816550daaa",
    "worker_observation_digest": "sha256:4e9a8933c8e81761381e9c28f1130b5f0955007aeebffbac9de1f60122414bfd",
    "workload_header_digest": "sha256:24a4fd5880a5f20ec02a514c9d69788a5c2c44578da609f023839fff7481d4b9",
    "workload_manifest_file_digest": "sha256:ce14428db957c2e5f5000d37137b1024bd60a8b3d850f4f87024728b4fc3f310",
    "workload_payload_digest": "sha256:7aec3a02cdfe8fa687b6531d2a37849418bc056989b1cbdc397730b6dfebaadd"
  },
  "report_digest": "sha256:106127db374549d155ccd2562cf94cd6a7256aad6e6b8c528fe82939c63f3fc7",
  "schema_version": "tuc.bounded_compiler_emitted_gpu_observation_report.v0",
  "workload": {
    "dtype": "float32",
    "elementwise_semantics": "relu",
    "input_policy": "fixed_public_non_sensitive_test_vector",
    "input_shapes": [
      [
        4,
        8
      ],
      [
        8,
        2
      ]
    ],
    "operation_families": [
      "matmul",
      "elementwise"
    ],
    "output_shape": [
      4,
      2
    ],
    "reference_correctness_passed": true,
    "semantic_origin": "accepted_triton_research_source_intent",
    "workload_contract": "research_triton_matmul_relu_4x8x2_f32.v0"
  }
}
